id,Title,Content
9693,"Auf die Freundschaft! (o_o) Sagen Sie mal wieder Danke.","<p class=""p--teaser-text"">Freunde machen das Leben erst lebenswert. Deshalb ist es Zeit, Danke zu sagen – mit dem ""Tag der Freundschaft"" am 30. Juli 2017.</p>

<div class=""col-sm-24"">
<div class=""bg-secondary-content content"">

Der eine hat fünf, die andere drei. Doch auf die Menge von echten Freunden kommt es gar nicht an. Wichtig ist, dass man sich auf sie verlassen kann – in guten, wie in weniger guten Zeiten. Gute Freunde bringen einen weiter, helfen in dunklen Stunden und sind, je nach Situation, mal Fürsprecher, Trostspender und auch mal unser schlechtes Gewissen.
<h2>Kurz: Sie sind unentbehrlich.</h2>
Da trifft es sich gut, dass am 30. Juli 2017, mit dem „Internationalen Tag der Freundschaft“ an sie gedacht wird. Noch schöner als an sie denken ist natürlich ein kleines Dankeschön – zum Beispiel ein Blumenstrauß von „<a href=""https://www.einkaufsbahnhof.de/muenchen-hauptbahnhof/shoppen/blumen/blumen-am-bahnhof-s8212"" target=""_blank"" rel=""noopener"">Blumen am Bahnhof</a>“, eine schöne Karte von „<a href=""https://www.einkaufsbahnhof.de/muenchen-hauptbahnhof/shoppen/geschenke/philatelie-ansichtskarten-s6800"" target=""_blank"" rel=""noopener"">Philatelie und Ansichtskarten</a>“ oder eine Flasche Sekt von <a href=""https://www.einkaufsbahnhof.de/muenchen-hauptbahnhof/schlemmen/lebensmittel/edeka-ernst-s13099"" target=""_blank"" rel=""noopener"">Edeka Ernst</a>.

</div>
</div>"
9694,"Küssen geboten! (o_o) Der Tag des Kusses","<p class=""p--teaser-text"">Freundschaftlich, sinnlich, leidenschaftlich oder liebevoll: Es gibt viele Wege den internationalen ""Tag des Kusses"" am 6. Juli 2017 zu begehen.</p>
Ein Kuss ist so persönlich wie ein Fingerabdruck. Und er kennt viele, viele Facetten. So gibt es den leidenschaftlichen Kuss, den liebevollen, sinnlichen und freundschaftlichen. Um des Menschen schönsten Zuneigungsbeweis zu würdigen, erfanden die eigentlich als eher zugeknöpft geltenden Briten in den 1990er Jahren den „Tag des Kusses“. Wohl weniger, weil beim Küssen 30 Gesichtsmuskeln aktiviert werden, sondern weil er als Zeichen der Liebe gilt.

Um einen Kuss perfekt zu machen, können Lippenstift, Lipgloss, Peeling und Lippenpflegeprodukte nicht schaden – zu finden am Münchner Hauptbahnhof unter anderem bei der <a href=""https://www.einkaufsbahnhof.de/muenchen-hauptbahnhof/shoppen/shops-drogerien/mueller-drogerie-s6813"">Müller Drogerie</a> und <a href=""https://www.einkaufsbahnhof.de/muenchen-hauptbahnhof/shoppen/hairstyle-kosmetik-beauty/muenchen_hbf_kiko_milano-s9908"">Kiko Milano</a>."
9698,"Reisen bildet (o_)","<p class=""p--teaser-text"">An den Münchner Einkaufsbahnhöfen lassen die Reisebüros Urlaubsträume wahr werden ? auch am 27. September, dem Welttourismustag.</p>
Am 27. September feiert die Welttourismusorganisation der UN in jedem Jahr den Welttourismustag – und weist darauf hin, dass Tourismus nicht nur die Lebensqualität verbessern, sondern auch den Umweltschutz, das vielfältige Kulturerbe und sogar den Frieden unterstützen kann.

Dabei ist der Tourismus nicht nur ein wichtiger Wirtschaftsfaktor zahlreicher Regionen, das Bereisen und Erleben anderer Länder und Kulturen erweitert zugleich den eigenen Horizont und beschert unvergessliche Erlebnisse.
Wen jetzt die Reiselust gepackt hat, der besucht am besten gleich eins der Reisebüros an den Münchner Einkaufsbahnhöfen. Ob Kurzurlaub oder Fernreise – die Reisebüros im Bahnhof, das DB Reisezentrum oder das <a href=""https://www.einkaufsbahnhof.de/muenchen-hauptbahnhof/shoppen/reisebuero/eurostar-reisebuero-s6769"" target=""_blank"" rel=""noopener"">Eurostar Reisebüro</a> finden bestimmt die passende Reise."
9699,"Neu: McDonald?s in Pasing (o_)","<p class=""p--teaser-text"">Mit der neueröffneten McDonald’s-Filiale ist der Einkaufsbahnhof in München Pasing ab sofort um ein Schlemmerparadies reicher.</p>
Einen leckeren Big Mac-Burger und krosse Pommes gegen den großen Hunger vor der langen Zugfahrt, einen Cappuccino während der Umsteigezeit oder einen gesunden Wrap zum Mitnehmen für die Mittagspause – Besucher des Einkaufsbahnhofs in München Pasing können sich ab sofort über die neueröffnete McDonald’s-Filiale freuen. Der neuste Standort von Deutschlands beliebtestem Fast-Food-Restaurant befindet sich im Bahnhof München Pasing am Ausgang Bahnhofsvorplatz. Die Filiale ist täglich von 6 bis 1 Uhr geöffnet.

<strong>Übrigens:</strong> Am 18. September 2017 ist in den USA der Tag des Cheeseburgers – die perfekte Gelegenheit, dem neuen McDonald’s in Pasing einen Besuch abzustatten."
9700,"Hallo Sparschwein! (o_)","<p class=""p--teaser-text"">Am 31. Oktober findet der Weltspartag statt. Die Finanzexperten am Münchner Hauptbahnhof wissen, worauf es beim Sparen ankommt.</p>
Die Zeiten, in denen es satte Sparzinsen gab, sind zwar schon länger her – doch auch heute noch kann man mit kleinen Summen große Ziele erreichen. Ob lang ersehnte Wünsche, Rücklagen für schlechte Zeiten oder eine Vorsorge fürs Alter, Sparen ist eine Investition in die eigene Zukunft. Grund genug, sich am 31. Oktober 2017, dem offiziellen Weltspartag, einmal genauer mit den eigenen Sparzielen und dem Thema Geld zu beschäftigen.

Beispielsweise bei den Finanzexperten am Münchner Hauptbahnhof: Die <a href=""https://www.einkaufsbahnhof.de/muenchen-hauptbahnhof/shoppen/banken/sparda-bank-s6755?ref=search"" target=""_blank"" rel=""noopener"">Sparda-Bank München</a>hilft in der Querbahnsteighalle ihren Kunden beispielweise dabei, ihre persönlichen Finanzen optimal zu organisieren. Tipps zu Reisezahlungsmitteln gibt es bei der <a href=""https://www.einkaufsbahnhof.de/muenchen-hauptbahnhof/shoppen/banken/reisebank-aussen-suedseite--s6728?ref=search"" target=""_blank"" rel=""noopener"">Reisebank</a> in der Schalterhalle und am Südausgang, während <a href=""https://www.einkaufsbahnhof.de/muenchen-hauptbahnhof/shoppen/banken/muenchen-euronet-s9216"" target=""_blank"" rel=""noopener"">Euronet</a> in der S-Bahn Verteilerebene Services und Dienstleistungen für Privat- und Geschäftskunden an, unabhängig davon, bei welcher Bank ihr Konto ist."
9702,"Mach auf die Tür ? (o_)","<p class=""p--teaser-text"">Es geht schon wieder mit Riesenschritten auf Weihnachten zu. Adventskalender steigern die Vorfreude mit ihren schönen Überraschungen.</p>
Es weihnachtet wieder sehr. Überall stimmen jetzt Kränze, Gebinde und typische Leckereien auf die Zeit ein, die für viele die schönste des Jahres ist. Doch was wäre der Countdown aufs große Fest ohne den Adventskalender? Nichts begleitet die Vorfreude auf schönere Weise, als das Öffnen der 24 Türchen mit den täglichen Überraschungen. Ob klassisch, bunt, romantisch, winterlich oder mit den typischen Weihnachtsmotiven: Der Adventskalender verkürzt die Zeit bis zum Heiligabend und lässt den ganzen Dezember über eine feierliche Stimmung einkehren.

Überzeugen Sie sich selbst: In den Geschäften am Münchner Einkaufsbahnhof trifft dieser Tage wieder ein Riesenangebot an Adventskalendern für jedes Alter und jeden Geschmack ein."
9703,"Geschenkeideen, die auf dem Nachhauseweg liegen (o_)","<p class=""p--teaser-text"">Dass sich der Münchner Hauptbahnhof zu einer führenden Shopping-Adresse entwickelt hat, zahlt sich in der Weihnachtszeit besonders aus.</p>
Was wäre das große Fest ohne Geschenke? Doch leider steht vor der Bescherung alle Jahre wieder der berüchtigte Weihnachtsstress: Volle Innenstädte, nerviger Verkehr und ungünstige Öffnungszeiten können den Shoppingspaß schnell zur Hetzjagd machen.Von Besinnlichkeit keine Spur, wäre da nicht der Münchner Einkaufsbahnhof.Mit seiner weihnachtlichen Atmosphäre, der hervorragenden Verkehrsanbindung und den über 80 Geschäften ist er längst vom Geheimtipp zur echten Alternative avanciert. Denn der festlich geschmückte Rahmen mit den romantischen Lichterketten, Tannendekorationen und die langen Öffnungszeiten bescheren Reisenden wie Shoppern genügend Zeit und Muße und jede Menge Geschenkideen.

Beispiel <a href=""https://www.einkaufsbahnhof.de/muenchen-hauptbahnhof/shoppen/hairstyle-kosmetik-beauty/muenchen_hbf_rituals_cosmetics-s13301"" target=""_blank"" rel=""noopener"">Rituals Cosmetics</a>: Der Body- and Home-Spezialist in der S-Bahn Verteilerebene ist ganz auf Weihnachten eingestellt und hat sogar sonntags von 10 bis 19 Uhr geöffnet. Neben diversen Geschenk-Sets für Damen und Herren betört derzeit eine limitierte „Winter Edition“ mit Duschschaum, Körpercreme, Peeling, Massagekerze, Duftstäbchen und sogar indischem Tee Körper und Sinne.
<h3>Alle Sets sind geschmackvoll verpackt</h3>
<strong>Besonders praktisch:</strong> Alle Sets sind bereits fertig in geschmackvolle Kartons verpackt, nur verschenken muss man sie noch selber. Das gilt auch für viele Einzel- und Heimprodukte, die mit ihren erlesenen Düften und Essenzen selbst das Abspülen zu einem sinnlichen Erlebnis machen. Für Mutter und Kind gibt es ebenfalls edle Lotionen und Accessoires mit Verwöhngarantie. Und wie es sich für eine Rituals-Filiale in einem Einkaufsbahnhof gehört, darf auch die spezielle Auswahl an Größen und Geschenksets für die Reise nicht fehlen.

<strong>Apropos:</strong> Wie wäre es mit einem unterhaltsamen Schmöker für unterwegs oder für die freien Tage? Wer seine Liebsten oder sich selbst mit einem besonderen Buch zu Weihnachten beschenken möchte, hat in den Shops von <a href=""https://www.einkaufsbahnhof.de/muenchen-hauptbahnhof/shoppen/buch-presse/k-presse-buch-zwischengeschoss--s6818"" target=""_blank"" rel=""noopener"">k presse + buch</a> und <a href=""https://www.einkaufsbahnhof.de/muenchen-hauptbahnhof/shoppen/buch-presse/p-b-schalterhalle--s6741"" target=""_blank"" rel=""noopener"">Press&amp;Books (P&amp;B)</a> unter hunderten von Werken aus allen Genres die Qual der Wahl.
<h3>Wie wäre es mit einem Trikot vom FC Bayern München?</h3>
Der FC Bayern München hat wiederum so viele Fans, dass die Chancen, auch mit einem Trikot, einem Dusch-Set oder einer Tasse aus dem <a href=""https://www.einkaufsbahnhof.de/muenchen-hauptbahnhof/shoppen/geschenke/fan-shop-fc-bayern-muenchen-s6815"" target=""_blank"" rel=""noopener"">FC-Bayern-Fanshop</a> im Zwischengeschoss einen Volltreffer zu landen, riesig sind. Wer stattdessen lieber eine hübsche Tasche, eine Uhr, Schmuck, Lederwaren oder ein schönes Poster unter den Baum legen möchte, findet bei <a href=""https://www.einkaufsbahnhof.de/muenchen-hauptbahnhof/shoppen/geschenke/muenchen_top-trend-geschenkartikel-s6757"" target=""_blank"" rel=""noopener"">Top-Trend</a> in der Schalterhalle selbst an den Wochenenden bis 22 Uhr eine Riesenauswahl verschiedenster Geschenkartikel.

Zu den Klassikern für die Gabentische gehören natürlich auch edle Tropfen und feines Rauchwerk, ob hochprozentig, sprudelnd oder exklusiv: Hier wird man in einem der Lebensmittelmärkte ebenso fündig, wie bei <a href=""https://www.einkaufsbahnhof.de/muenchen-hauptbahnhof/shoppen/tabak/t.h.kleen_ug-s13539"" target=""_blank"" rel=""noopener"">T.H. Kleen</a> oder <a href=""https://www.einkaufsbahnhof.de/muenchen-hauptbahnhof/shoppen/tabak/tabak-berger-s6752"" target=""_blank"" rel=""noopener"">Tabak Berger</a>, wenn es mal eine besondere Zigarre oder ein Feuerzeug sein soll.
<h3>Weihnachten und Mode gehören zusammen</h3>
Und was wäre Weihnachten ohne Mode? Mit <a href=""https://www.einkaufsbahnhof.de/muenchen-hauptbahnhof/shoppen/mode-schmuck/muenchen_claires-s8879"" target=""_blank"" rel=""noopener"">Claire’s</a>, <a href=""https://www.einkaufsbahnhof.de/muenchen-hauptbahnhof/shoppen/mode-schmuck/muenchen_calzedonia-s8713"" target=""_blank"" rel=""noopener"">Calzedonia</a>, <a href=""https://www.einkaufsbahnhof.de/muenchen-hauptbahnhof/shoppen/mode-schmuck/arico-aussen-suedseite--s7130"" target=""_blank"" rel=""noopener"">Arico</a>, <a href=""https://www.einkaufsbahnhof.de/muenchen-hauptbahnhof/shoppen/mode-schmuck/accessorize-s6753"" target=""_blank"" rel=""noopener"">Accessorize</a> und <a href=""https://www.einkaufsbahnhof.de/muenchen-hauptbahnhof/shoppen/mode-schmuck/muenchen_goertz-s6797"" target=""_blank"" rel=""noopener"">Görtz</a> hat gleich eine ganze Reihe von Fashionspezialisten das Sortiment auf die Geschenkezeit abgestimmt. Von günstigem Schmuck und Accessoires bis hin zu aktuellen Sneakers, stilvollen Taschen und trendiger Kleidung für Damen, Herren und Kinder gibt’s hier alles, selbst wenn man bei einem Last-Minute-Kauf noch rasch etwas Besonderes benötigt.

Nebenbei können sich die Besucher im Münchner Einkaufsbahnhof bei ihrem Shopping-Bummel auch mit traditionellen weihnachtlichen Gaumenfreuden wie Lebkuchen, Christstollen oder Glühwein versorgen. Und wem der Sinn nach einer kleinen musikalischen Auszeit vom Weihnachtseinkauf steht, für den sind die kostenlosen Weihnachtskonzerte ans Herz gelegt, die noch bis zum 24. Dezember an den Münchner Bahnhöfen stattfinden. <a href=""https://www.einkaufsbahnhof.de/muenchen-hauptbahnhof/erleben/muenchen_schoene_vorweihnachtszeit-a14657"" target=""_blank"" rel=""noopener"">Alle Termine und Infos finden Sie hier.</a>"
9704,"Bäckerei Der Beck: Lecker. Leben. Leidenschaft. (o_o)","<p class=""p--teaser-text"">Die Traditionsbäckerei Der Beck bietet fränkische und internationale Brotspezialitäten, leckere Snacks und Kaffeegenuss – auch am Hauptbahnhof</p>
Vom knusprigen fränkischen Bauernbrot bis zum saftigen Kuchen: Die Bäckerei <a href=""https://www.einkaufsbahnhof.de/nuernberg-hauptbahnhof/schlemmen/baeckereien/der-beck-s12711"">Der Beck</a> am Nürnberger Hauptbahnhof hat für jeden Geschmack das passende Produkt. Seit August 2016 sind die Erzeugnisse des in Erlangen angesiedelten Unternehmens auch in den Rubenbauer Genusswelten am Nürnberger Hauptbahnhof zu finden. Ganz ohne künstliche und chemische Zusätze werden die Brote, Baguettes und Brötchen des Unternehmens nach alter Tradition hergestellt. Einige Brotspezialitäten, wie beispielsweise das beliebte Tessino, werden dabei im Steinofen gebacken und erhalten so eine besonders rösche Kruste und einen aromatischen Brotgeschmack. Zahlreiche leckere Snackideen und Kaffeespezialitäten runden die Angebotspalette ab. Übrigens schenkt Der Beck seit vielen Jahren bereits Fairtrade-Kaffee aus und setzt durch die Verwendung von Mehrwegbechern aus Bambus aktiv ein Zeichen für den Umweltschutz.
<h3>TRADITIONSREICHES UNTERNEHMEN</h3>
Die Wurzeln des Unternehmens Der Beck reichen zurück bis ins 19. Jahrhundert, genauer gesagt, bis zum Jahr 1895: Mit der Bäckerei Ziegler in Tennenlohe legten die Großeltern von Siegfried Beck den Grundstein für das spätere Unternehmen Der Beck. Vor über 30 Jahren gründeten Siegfried und Petra Beck dann das Unternehmen Der Beck GmbH und machten es zu einem der größten Gastronomiebetriebe der Bundesrepublik.
<h2>Backen ist Handwerk – und das haben die Bäcker und Konditoren von Der Beck gelernt.</h2>
Für die Zubereitung von rund 30 Brotsorten, 30 verschiedenen Brötchen und rund 95 Sorten Feingebäck setzt das fränkische Unternehmen auf individuelle Rezepte und hochwertige regionale Zutaten. Die Spezialitäten des Unternehmens werden täglich frisch hergestellt. Drei Mal am Tag werden diese an die jeweiligen Filialen geliefert; einige davon werden frisch vor Ort gebacken. Auf diese Weise wird absolute Frische garantiert. Ein Vorgehen, das auch Experten überzeugt: So erhielten im April diesen Jahres unter anderem das Tessino und das Kellerbrot das Qualitätssiegel „sehr gut“ des Instituts für Qualitätssicherung von Backwaren.
<h3>FRANZÖSISCHE BACKKUNST MIT EMPFEHLUNG VON JOHANN LAFER</h3>
Die jüngsten Mitglieder des Der Beck-Produktportfolios sind dabei die nach französischem Vorbild gebackenen „VoiLA“-Brote, die in Kooperation mit Spitzenkoch Johann Lafer geschaffen wurden. Sowohl für das Baguette als auch für das Landbrot wird original französisches Weizenmehl verwendet; das VoiLA Landbrot wird zudem im Steinofen gebacken und erhält dadurch seine rustikale, etwas dunklere Kruste. Für Der Beck hat der Genussbotschafter außerdem verschiedene Aufstrich-Varianten entwickelt, die besonders gut zu den aktuellen Brotkreationen passen.
<h3>DEN BÄCKERN ÜBER DIE SCHULTER SCHAUEN</h3>
Übrigens: Wer mehr über die Produktion der frischen Backwaren von Der Beck erfahren möchte, kann den Bäckern bei einer Betriebsführung über die Schulter schauen. Bei diesen erfahren Besucher unter anderem, wie aus regionalen Zutaten beste Brot- und Backwaren ohne Zusatzstoffe entstehen, welche Tätigkeiten auch heute noch gutes altes Bäckerhandwerk sind und welche Aufgaben mittlerweile von hochmodernen Maschinen übernommen werden. Mehr Informationen hierzu finden sich auf der <a href=""https://www.der-beck.de/"">Homepage von Der Beck</a>."
9705,"Perfekte Urlaubseinstimmung (o_o)","<p class=""p--teaser-text"">Noch wenige Tage bis zum Beginn der Urlaubszeit. Am Hauptbahnhof Nürnberg lässt sich die schönste Zeit des Jahres schon vorher genießen.</p>
Endlich stehen die Sommerferien vor der Tür, da heißt es für die meisten, nichts wie ab in den Urlaub. Wer sich schon vorab auf die schönsten Tage des Jahres einstimmen möchte, sollte sich den 20. Juli 2017 jetzt ganz dick in seinem Kalender vormerken. Denn an diesem vorletzten Donnerstag vor den großen Schulferien wird das Reisefieber erst so richtig angeheizt. Wo? Natürlich am Hauptbahnhof Nürnberg, bekannt für seine tollen Sonderaktionen und der beliebte Ausgangspunkt für Reisen zu den schönsten Orten in der näheren Umgebung und in die weite, weite Welt. Unter dem Motto „Sommer-Aktion 2017“ steigt hier von 11 bis 19 Uhr ein sommerliches Strandvergnügen, das der Vorfreude auf die kommende Urlaubssaison noch mal so richtig Schub gibt und dies – im Gegensatz zu manchen Reisezielen – garantiert unabhängig von der Witterung.

Schauplatz des Geschehens ist die östliche Längshalle des Nürnberger Hauptbahnhofs, zwischen Bahnhofsbuchhandlung <a href=""https://www.einkaufsbahnhof.de/nuernberg-hauptbahnhof/shoppen/buch-presse/schmitt-hahn-presse-buch-osthalle--s6887"">Schmitt &amp; Hahn</a> und der <a href=""https://www.einkaufsbahnhof.de/nuernberg-hauptbahnhof/shoppen/shops-drogerien/mueller-drogeriemarkt-eg--s6893"">Müller Drogerie</a>. Gespickt mit jeder Menge toller Ideen, Spielen und Aktionen, wird für Groß und Klein, Nah- und Fernreisende, Familien, Singles oder „Zuhausebleibende“, sprich: für alle, die einmal sommerlichen Spaß der besonderen Art genießen wollen, unterhaltsamstes Urlaubsfeeling verbreitet.

Die bunte Aktionsfläche ist schon von weitem zu erkennen: „Beachflags“ und gemütliche Liegestühle wie man sie von Urlaub und Badevergnügen her kennt, laden zum Relaxen und Genießen ein. Wer sich dann in der originellen Fotobox kostenlos mit Sonnenbrillen, Strohhüten, Schwimmreifen und vielen weiteren sonnigen Utensilien ablichten lassen möchte, kann sich tatsächlich fühlen, wie an einem erholsamen Sandstrand irgendwo in der Karibik. Und seine Freunde und Liebsten sozusagen humorvoll von dort aus grüßen…
<h2>Sommer im Hauptbahnhof Nürnberg</h2>
Zu den Hauptattraktionen gehören Verlosungen mit so vielen Klein- und Trostpreisen, dass man sich jederzeit die besten Chancen ausrechnen darf. Das gilt natürlich ganz besonders für die Kleinsten, die beim lustigen Entenangeln mindestens so viel Spaß haben wie ihre Eltern beim Zusehen und Fotografieren. Sonnenklar, dass die Kids für so viel Geschicklichkeit auch mit kleinen Gewinnen belohnt werden.

Das absolute Highlight der „Sommer-Aktion 2017“ ist allerdings das Glücksrad. Wer eine Einkaufsquittung ab drei Euro aus einem der vielen Shops des Hauptbahnhofs Nürnberg vorlegen kann, darf dran drehen. Und das kann sich wirklich mehr als lohnen. Denn neben vielen kleinen Preisen winkt als Hauptgewinn die perfekte Urlaubsüberraschung: Ein Reisegutschein im Wert von nicht weniger als 500 Euro, einzulösen direkt im Reisebüro im Nürnberger Hauptbahnhof.

Optimisten können am 20. Juli 2017 also gerne schon mal ihre Koffer mitbringen, genügend Züge, mit denen sich auf der Stelle zu den schönsten Traumzielen dieses Sommers aufbrechen lässt, stehen jederzeit zur Abfahrt bereit…"
9706,"Pommes-Freunde aufgepasst! (o_o)","<p class=""p--teaser-text"">Am 13. Juli 2017 wird die Lieblings-Beilage mit dem ""Pommes-Tag"" offiziell geehrt. Egal ob mit Ketchup, Majo oder pur – Pommes passen immer.</p>
Am 13. Juli 2017 wird der wohl beliebtesten Beilage in deutschen Küchen eine Referenz erwiesen – der Pommes-Frites mit dem „Pommes-Tag“. Schließlich sind Pommes von keiner Speisekarte wegzudenken. Die knusprig frittierten Kartoffelstifte schmecken immer – ob mit Ketchup, Majo, pur oder mit Käse überbacken. Die goldgelben Gesellen erfreuen sich natürlich nicht nur in heimischen Gefilden großer Beliebtheit, auch in England (man denke an „Fish &amp; Chips“), Amerika (kein Burger ohne Pommes) und auch im Feinschmeckerland Frankreich (perfekt zu Chateaubriand) schnalzt der Feinschmecker mit der Zunge.
<h2>Lecker schmecker!</h2>
Doch soweit muss man gar nicht fahren. Der Nürnberger Hauptbahnhof hält schließlich eine große Auswahl an Pommes parat: zum Beispiel lässt sich bei <a href=""https://www.einkaufsbahnhof.de/nuernberg-hauptbahnhof/schlemmen/gastronomie/pommes-co-s12697"" target=""_blank"" rel=""noopener"">Pommes &amp; Co.</a>, <a href=""https://www.einkaufsbahnhof.de/nuernberg-hauptbahnhof/schlemmen/gastronomie/gosch-sylt-s12694"" target=""_blank"" rel=""noopener"">Gosch Sylt</a>, <a href=""https://www.einkaufsbahnhof.de/nuernberg-hauptbahnhof/schlemmen/gastronomie/burger-king-s6921"" target=""_blank"" rel=""noopener"">Burger King</a> und <a href=""https://www.einkaufsbahnhof.de/nuernberg-hauptbahnhof/schlemmen/gastronomie/mcdonald-s-eg--s6878"" target=""_blank"" rel=""noopener"">McDonald’s</a> die leckere Pommes-Welt vielfältig erleben. Guten Appetit!"
9707,"Einmal herzhaft zubeißen! (o_o) – Das Burger-Spezial","<p class=""p--teaser-text"">Passend zum Tag des Burgers am 27. August 2017 stellen wir die drei Burger-Spezialisten am Nürnberger Hauptbahnhof vor.</p>

<div class=""col-sm-24"">
<div class=""bg-secondary-content content"">

Burger sind der Inbegriff des „American Way of Life“ und auch in Deutschland zählen sie zu den beliebtesten Gerichten. Entscheidend dafür sind saftige Patties, knackiger Salat, leckere Brötchen und würzige Saucen. Wir haben uns bei den drei Burger-Spezialisten am Nürnberger Hauptbahnhof umgeschaut und stellen – passend zum britischen Tag des Burgers am 27. August 2017 – ihre leckersten Kreationen vor.
<h3>McDonald’s</h3>
Der Marktführer unter den deutschen Burger-Restaurants ist <a href=""https://www.einkaufsbahnhof.de/nuernberg-hauptbahnhof/schlemmen/gastronomie/mcdonald-s-eg--s6878?ref=search"" target=""_blank"" rel=""noopener"">McDonald’s</a>: Bereits vor 46 Jahren, am 4. Dezember 1971, eröffnete in der Münchner Martin-Luther-Straße die erste Filiale in Deutschland. Mittlerweile gibt es deutschlandweit knapp 1.500 Restaurants, in denen rund 2,7 Millionen Gäste sich ihre Burger schmecken lassen. Auch in der Osthalle am Nürnberger Hauptbahnhof. Apropos Burger, Burgerfans finden bei McDonald’s eine breite Auswahl für verschiedenste Geschmäcker. Darunter: die klassischen Hamburger oder Cheeseburger, Hamburger Royal TS oder McRib. Für Geflügel- und Fischfans hat McDonald’s verschiedene Chickenburger sowie den Filet-o-Fish im Angebot und Vegetarier können beherzt beim Veggieburger TS zubeißen. Übrigens: Die Burger von McDonald’s gibt es schon ab einem Euro.
<h2>Burger, Burger, Burger.</h2>
<h3>Burger King</h3>
Geschmack ist King – heißt es hingegen bei <a href=""https://www.einkaufsbahnhof.de/nuernberg-hauptbahnhof/schlemmen/gastronomie/burger-king-s6921?ref=search"" target=""_blank"" rel=""noopener"">Burger King</a>! Und am besten schmeckt den Gästen der Whopper: Unglaubliche 2,1 Milliarden Mal geht der Bestseller jedes Jahr weltweit über die Ladentheke. Neben den Klassikern hat der 1954 in Miami gegründete Burger-Experte noch über 20 weitere Burger zur Auswahl. Dazu zählen unter anderem verschiedene Cheeseburger-, Whopper- und Chicken-Variationen. Für Hot-Dog-Fans hat Burger King zudem den Grilled Dog im Angebot – wahlweise als Classic, Chili Cheese oder Crispy. Ganz ohne Fleisch kommt hingegen der Country-Burger aus.
<h3>Kentucky Fried Chicken</h3>
Ganz auf Burger mit frischem Hähnchenfleisch hat sich hingegen <a href=""https://www.einkaufsbahnhof.de/nuernberg-hauptbahnhof/schlemmen/gastronomie/kfc_eg-s11284"" target=""_blank"" rel=""noopener"">Kentucky Fried Chicken</a> spezialisiert: Neben leckeren Hähnchenteilen oder Hot Wings gibt es hier beispielsweise den für Genießer geeigneten KFC Gourmet Chicken, den B.O.S.S. Burger mit Monterey Jack Käse und der Spezial B.O.S.S Sauce oder den Double Crunch Burger mit zwei knusprigen, panierten Crispys. KFC steht dabei für 100 Prozent Hähnchenfleisch, eine einzigartige Zubereitung von Hand und unwiderstehlichen Geschmack.

Weitere Burger-Spezialitäten gibt es am Nürnberger Hauptbahnhof übrigens auch in der <a href=""https://www.einkaufsbahnhof.de/nuernberg-hauptbahnhof/schlemmen/gastronomie/mediterrano-db-gastronomie-s6896"" target=""_blank"" rel=""noopener"">Cantina Estación Mediterrano</a>.

</div>
</div>"
