id,Title,Content
15908,"Reisereportage: <br>Zug zum Glück","<p class=""p--teaser-text"">Die glücklichsten Menschen der Welt leben in Skandinavien. Um ihrem Geheimnis auf die Schliche zu kommen, fährt unser Autor mit dem Zug von Göttingen aus 600 Kilometer gen Norden.</p>
Der Mensch strebt sein Leben lang nach diesem einen Gefühl, nach dem vermutlich schon der erste Homo sapiens süchtig war: das Glück. Deshalb sind die Regale im Buchhandel prall gefüllt mit Anleitungen zum Glücklichsein, von Achtsamkeit und Meditation über Ernährungstipps bis hin zur Flucht in die Wildnis. Unabhängig von diesen Ansätzen fällt eines auf: Das Glück sucht man am besten im Norden. Dort leben laut dem UN-Glücksreport die glücklichsten Menschen des gesamten Erdballs.
<h2>Eine Reise Richtung Glück</h2>
Und genau deshalb fahre ich an diesem sonnigen Morgen mit dem Zug von der wohl durchschnittlich glücklichen Stadt Göttingen immer weiter Richtung Norden mit dem Ziel, dem Glück in Dänemark auf die Spur zu kommen. Denn nicht das Dolce Vita der Italiener oder das Savoir-vivre der Franzosen bringt die zufriedensten Menschen hervor, sondern das dänische Hygge – ein Lebensstil, bei dem besonders auf Gemütlichkeit geachtet wird. Und auch hierzulande leben vor allem im Norden der Republik besonders sorgenfreie Menschen: Laut dem Glücksatlas der Deutschen Post steigt die Lebenszufriedenheit, je näher man der dänischen Grenze kommt.

Ich mache mich deshalb auf den Weg von Niedersachsen über Hamburg und Schleswig-Holstein bis nach Aarhus – die dänische Stadt, die den Beinamen „Stadt des Lächelns“ trägt. Meine erste drängende Frage: Kann man das Glück eigentlich erlernen?

[gallery size=""full"" ids=""eyJ1cmwiOiJodHRwczpcL1wvd3d3LmVpbmthdWZzYmFobmhvZi5kZVwvd3AtY29udGVudFwvdXBsb2Fkc1wvMjAxOFwvMDhcL0VLQl9XRUJfQW5sYXNzX0dhbGxlcnlfODIweDQ2MHB4XzEwLTEuanBnIiwidGl0bGUiOiJFS0JfV0VCX0FubGFzc19HYWxsZXJ5XzgyMHg0NjBweF8xMCIsImNhcHRpb24iOiJNaXJpYW0gR1x1MDBmNmhuIiwiYWx0IjoiIiwiZGVzY3JpcHRpb24iOiJEaWUgU3VjaGUgbmFjaCBkZW0gR2xcdTAwZmNjayBiZWdpbm50IGluIE5pZWRlcnNhY2hzZW46IFZvbiBHXHUwMGY2dHRpbmdlbiBnZWh0IGVzIG1pdCBkZW0gWnVnLi4uIn0=,eyJ1cmwiOiJodHRwczpcL1wvd3d3LmVpbmthdWZzYmFobmhvZi5kZVwvd3AtY29udGVudFwvdXBsb2Fkc1wvMjAxOFwvMDhcL0VLQl9XRUJfQW5sYXNzX0dhbGxlcnlfODIweDQ2MHB4XzExLTEuanBnIiwidGl0bGUiOiJFS0JfV0VCX0FubGFzc19HYWxsZXJ5XzgyMHg0NjBweF8xMSIsImNhcHRpb24iOiJNaXJpYW0gR1x1MDBmNmhuIiwiYWx0IjoiIiwiZGVzY3JpcHRpb24iOiIuLi5pbiBkaWUgTGFuZGVzaGF1cHRzdGFkdC4gRG9ydCB0aHJvbnQgc2VpdCBcdTAwZmNiZXIgMTUwIEphaHJlbiBFcm5zdCBBdWd1c3QgSS4gYXVmIGRlbSBCYWhuaG9mc3ZvcnBsYXR6LiJ9,eyJ1cmwiOiJodHRwczpcL1wvd3d3LmVpbmthdWZzYmFobmhvZi5kZVwvd3AtY29udGVudFwvdXBsb2Fkc1wvMjAxOFwvMDhcL0VLQl9XRUJfQW5sYXNzX0dhbGxlcnlfODIweDQ2MHB4XzEyLTEuanBnIiwidGl0bGUiOiJFS0JfV0VCX0FubGFzc19HYWxsZXJ5XzgyMHg0NjBweF8xMiIsImNhcHRpb24iOiJNaXJpYW0gR1x1MDBmNmhuIiwiYWx0IjoiIiwiZGVzY3JpcHRpb24iOiJEaWUgblx1MDBlNGNoc3RlIFN0YXRpb24gaXN0IEhhbWJ1cmcgXHUyMDEzIGxhdXQgUG9zdC1HbFx1MDBmY2Nrc2F0bGFzIGRpZSB6d2VpdGdsXHUwMGZjY2tsaWNoc3RlIFN0YWR0IERldXRzY2hsYW5kcy4gIn0=,eyJ1cmwiOiJodHRwczpcL1wvd3d3LmVpbmthdWZzYmFobmhvZi5kZVwvd3AtY29udGVudFwvdXBsb2Fkc1wvMjAxOFwvMDhcL0VLQl9XRUJfQW5sYXNzX0dhbGxlcnlfODIweDQ2MHB4XzEzLTEuanBnIiwidGl0bGUiOiJFS0JfV0VCX0FubGFzc19HYWxsZXJ5XzgyMHg0NjBweF8xMyIsImNhcHRpb24iOiJNaXJpYW0gR1x1MDBmNmhuIiwiYWx0IjoiIiwiZGVzY3JpcHRpb24iOiJadWZyaWVkZW5lciBzaW5kIGRpZSBNZW5zY2hlbiBudXIgaW4gU2NobGVzd2lnLUhvbHN0ZWluLiBMaWVndCBlcyBhbSBNZWVyLCBkYXMgZGFzIExhbmQgdW1zcFx1MDBmY2x0PyAifQ==,eyJ1cmwiOiJodHRwczpcL1wvd3d3LmVpbmthdWZzYmFobmhvZi5kZVwvd3AtY29udGVudFwvdXBsb2Fkc1wvMjAxOFwvMDhcL0VLQl9XRUJfQW5sYXNzX0dhbGxlcnlfODIweDQ2MHB4XzE0LTEuanBnIiwidGl0bGUiOiJFS0JfV0VCX0FubGFzc19HYWxsZXJ5XzgyMHg0NjBweF8xNCIsImNhcHRpb24iOiJNaXJpYW0gR1x1MDBmNmhuIiwiYWx0IjoiIiwiZGVzY3JpcHRpb24iOiJaaWVsIGRlciBSZWlzZSBpc3QgQWFyaHVzLCBkaWUgXHUyMDFlU3RhZHQgZGVzIExcdTAwZTRjaGVsbnNcIiB1bmQgSGVpbWF0IGRlcyBkXHUwMGU0bmlzY2hlbiBHbFx1MDBmY2Nrc3JlemVwdHMgSHlnZ2UuIn0=""]
<h3>GÖTTINGEN: GLÜCK NACH LEHRBUCH</h3>
Ich beginne meine Spurensuche am Göttinger Bahnhof, denn die Studentenstadt im südlichen Niedersachsen ist einer der wenigen Orte weltweit, an dem „Glück“ als Schulfach gelehrt wird. Kann man lernen, glücklich zu sein? Das frage ich auf dem Bahnhofsvorplatz eine Frau, die es wissen muss: Susanne Pflüger. Sie unterrichtet das Fach. „Auf das kleine Glück muss man achten“, sagt die 57-Jährige, „nicht nur auf die Knallpuffpeng-Momente.“

Eine Hälfte des menschlichen Glücks werde durch die Gene bestimmt, ein Zehntel durch die äußeren Umstände. „Den Rest macht die Einstellung“, sagt Susanne Pflüger. An genau der arbeitet die Lehrerin mit ihren Schülern. „Das Glück kann man trainieren“, sagt sie voller Überzeugung.

[gallery size=""full"" ids=""eyJ1cmwiOiJodHRwczpcL1wvd3d3LmVpbmthdWZzYmFobmhvZi5kZVwvd3AtY29udGVudFwvdXBsb2Fkc1wvMjAxOFwvMDhcL0VLQl9XRUJfQW5sYXNzX0dhbGxlcnlfODIweDQ2MHB4XzAxLTUuanBnIiwidGl0bGUiOiJFS0JfV0VCX0FubGFzc19HYWxsZXJ5XzgyMHg0NjBweF8wMSIsImNhcHRpb24iOiJUaG9tYXMgRXVnc3RlciIsImFsdCI6IiIsImRlc2NyaXB0aW9uIjoiQmVzc2VyIGF1ZiBkYXMga2xlaW5lIEdsXHUwMGZjY2sgYWNodGVuOiBTdXNhbm5lIFBmbFx1MDBmY2dlciwgTGVocmVyaW4gYW4gZGVyIEJCUyBSaXR0ZXJwbGFuIGluIEdcdTAwZjZ0dGluZ2VuLiJ9""]

Als hätten wir sie als Kulisse für dieses Gespräch bestellt, lassen sich Studenten auf Bänken neben uns sichtlich zufrieden die Sonnenstrahlen ins Gesicht scheinen. Susanne Pflüger blinzelt. Sie ist ein Mensch, der gerne lacht. Doch mit dem Glück ist es ihr sehr ernst. Innerlich stabil sein, seine Stärken kennen, sich das kleine Glück im Alltag bewusst machen, entschleunigen. Das sind ihre Schlüssel zu einem zufriedenen Leben.

Wenig später beschleunigt mein ICE und ich gleite durch die niedersächsische Landschaft. Endlich wieder WLAN, aber wer braucht schon Internet, wenn Städte, Dörfer und Wiesen an einem vorbeirauschen. Kein spektakuläres Land, aber irgendwie vertraut. Gehört das auch zum Glück? Ein Ort, an dem man sich geborgen fühlt? Vielleicht finde ich das in Hannover heraus, der Landeshauptstadt der Niedersachsen, die sich als „sturmfest“ und „erdverwachsen“ bezeichnen.
<h3>HANNOVER: GLÜCK DER HEIMAT</h3>
Zum Glück ist der berühmteste Treffpunkt der Stadt nur einen Steinwurf vom Hauptbahnhof entfernt. Köln trifft sich auf der Domplatte, Berlin an der Weltzeituhr und Hannover „unterm Schwanz“, dem Hinterteil des Reiterdenkmals von Ernst August I. Mit einem Skifahrer-Hüftschwung stoppt Thorald Abramowski seinen Segway vor dem Reiterbild. Er fällt auch sonst gleich auf. Abramowski trägt Cut, Zylinder und Kleeblatt: das traditionelle Outfit der Bruchmeister, die nach einem 700-jährigen Brauch für Ordnung auf dem weltweit größten Schützenfest in Hannover sorgen.

[gallery size=""full"" ids=""eyJ1cmwiOiJodHRwczpcL1wvd3d3LmVpbmthdWZzYmFobmhvZi5kZVwvd3AtY29udGVudFwvdXBsb2Fkc1wvMjAxOFwvMDhcL0VLQl9XRUJfQW5sYXNzX0dhbGxlcnlfODIweDQ2MHB4XzAyLTUuanBnIiwidGl0bGUiOiJFS0JfV0VCX0FubGFzc19HYWxsZXJ5XzgyMHg0NjBweF8wMiIsImNhcHRpb24iOiJUaG9tYXMgRXVnc3RlciIsImFsdCI6IiIsImRlc2NyaXB0aW9uIjoiRGVyIFVyc3BydW5nIGRlciBCcnVjaG1laXN0ZXIgbGllZ3QgaW0gMTQuIEphaHJodW5kZXJ0LiBUaG9yYWxkIEFicmFtb3Zza2kgc2V0enQgZGllIEdlc2NoaWNodGUgZm9ydC4ifQ==""]

„Die Bruchmeister engagieren sich für die Stadt und schaffen Identifikation“, sagt er, „und genau das ist für das persönliche Glück sehr wichtig.“ Lange lebte der 54-Jährige im Ausland, in London und Oxford. Erst nach seiner Rückkehr nach Hannover wusste er, wo er hingehört. „Heimat gibt Halt in einer schnelllebigen Welt, und das muss nicht zwangsläufig ein Ort sein.“
<h3>HAMBURG: GLÜCKSSTADT AM WASSER</h3>
Erste Kräne weisen den Weg zur Hansestadt. Wir überqueren die Elbbrücken. Links die Speicherstadt, rechts die Deichtorhallen. Möwen umflattern den Hauptbahnhof, wecken die Sehnsucht nach Weite und Meer. Hamburg ist die zweitglücklichste Stadt Deutschlands. Das steht so im Glücksatlas der Deutschen Post, und Susanne Krieg könnte sich sogar den ersten Platz im Ranking vorstellen. Sie trägt Friesennerz und Fischermütze und beobachtet das Treiben im Hauptbahnhof.

[gallery size=""full"" ids=""eyJ1cmwiOiJodHRwczpcL1wvd3d3LmVpbmthdWZzYmFobmhvZi5kZVwvd3AtY29udGVudFwvdXBsb2Fkc1wvMjAxOFwvMDhcL0VLQl9XRUJfQW5sYXNzX0dhbGxlcnlfODIweDQ2MHB4XzA4LTEuanBnIiwidGl0bGUiOiJFS0JfV0VCX0FubGFzc19HYWxsZXJ5XzgyMHg0NjBweF8wOCIsImNhcHRpb24iOiJUaG9tYXMgRXVnc3RlciIsImFsdCI6IiIsImRlc2NyaXB0aW9uIjoiU3RcdTAwZjZiZXJ0IHVuZ2V3XHUwMGY2aG5saWNoZSBHbFx1MDBmY2Nrc29ydGUgaW4gZGVyIEhhbnNlc3RhZHQgYXVmOiBCbG9nZ2VyaW4gU3VzYW5uZSBLcmllZy4ifQ==""]

„Frühmorgens die Elbchaussee entlangradeln bis zur Strandperle, die Himmelsleiter hinabsteigen und am Strand von Övelgönne dem Klatschen der Wellen lauschen – das kommt dem Glück schon ziemlich nahe“, sagt sie. Die Hamburg- Kennerin betreibt als „Frau Elbville“ einen Blog, auf dem sie ihre persönlichen Glücksorte abseits von Elbphilharmonie und Michel zeigt. Wie erklärt sie sich, dass die Bewohner der Hansestadt so glücklich sind? „Hamburg hat eine hohe Lebensqualität“, antwortet sie, „und mit Planten un Blomen eine grüne Lunge mitten in der Stadt.“

Und natürlich die Nähe zum Wasser, ergänzt sie. Davon gibt es auch in Schleswig-Holstein eine Menge. Auch hamburgtypisch und stimmungsaufhellend sind die süßen Franzbrötchen. Eines davon kaufe ich am Bahnhof und nehme es für die Fahrt mit. Auf Gleis 11 wartet bereits mein ICE nach Kiel.
<h3>KIEL: MEER GLÜCK</h3>
Echtes Glück ist von Wasser umgeben. Der Gedanke drängt sich auf, wenn man einen Blick auf die Karte wirft. Im Westen die Nordsee, im Osten die Ostsee und im Süden die Elbe. Nirgends ist es weit bis zum Meer. Vermutlich leben deshalb in Schleswig- Holstein die zufriedensten Menschen Deutschlands. Am Hauptbahnhof Kiel blicken die Passanten freundlich, aber auch nicht gerade ekstatisch glücklich drein. Was machen die Menschen hier im Norden richtig? Das will ich am Kieler Hauptbahnhof von Professor Peter Wippermann wissen.
<h2>Optimum statt Maximum</h2>
Er ist einer der führenden Glücksforscher und hat seine Strategien zu einem zufriedenen Leben in dem Buch „Lebe lieber froh“ verarbeitet. „Sich mit Menschen umgeben, die einem gut tun“, nennt der 58-Jährige als ersten Schritt zum Glück. Außerdem solle man nicht krampfhaft versuchen, das Maximum aus seinem Leben rauszuholen. „Stattdessen jede Situation neu anschauen und dann das jeweilige Optimum suchen“, erklärt Peter Wippermann.

Das Beste in meiner Situation scheint mir gerade der beherzte Biss in ein Matjesbrötchen, das mich gerade glücklicher macht als Schokolade, die erwiesenermaßen gute Laune machen kann. So gestärkt steige ich in den Zug in Richtung der dänischen Grenze.
<h3>BEI FLENSBURG: GRENZE ZUM GLÜCK</h3>
Weit entfernt kann das große Glück nicht mehr sein, hier im Norden Schleswig-Holsteins. Die Fahrt geht vorbei an grasenden Schafen und backsteinroten Orten, die die Namen Husby, Rieseby, Sörup oder Süderbrarup tragen. Meeresarme durchfließen sattgrüne Wiesen und hinter Feldern glitzert tiefblau die Ostsee.

[gallery size=""full"" ids=""eyJ1cmwiOiJodHRwczpcL1wvd3d3LmVpbmthdWZzYmFobmhvZi5kZVwvd3AtY29udGVudFwvdXBsb2Fkc1wvMjAxOFwvMDhcL0VLQl9XRUJfQW5sYXNzX0hlYWRlcl8xMDgweDU0MHB4XzAxLmpwZyIsInRpdGxlIjoiRUtCX1dFQl9Bbmxhc3NfSGVhZGVyXzEwODB4NTQwcHhfMDEiLCJjYXB0aW9uIjoiVGhvbWFzIEV1Z3N0ZXIiLCJhbHQiOiIiLCJkZXNjcmlwdGlvbiI6IklzdCBoaWVyIGRhcyBHbFx1MDBmY2NrIHp1aGF1c2U/IE1hbGVyaXNjaGUgTGFuZHNjaGFmdCBrdXJ6IHZvciBkZXIgZFx1MDBlNG5pc2NoZW4gR3JlbnplLiJ9""]

Plötzlich stoppt der Zug. Zwei dänische Grenzpolizisten steigen ein. „Ma jeg se dit pas – die Ausweise, bitte!“ Das Glück scheint wohl behütet. Den Ausweis habe ich aber zu Hause vergessen. „Nächstes Mal bitte dran denken“, raunzt der Grenzbeamte und lässt mich weiterreisen. Glück gehabt. Fröhlich überquere ich die Grenze nach Dänemark.
<h3>AARHUS: STADT DES LÄCHELNS</h3>
Ich fahre durch eine der zufriedensten Gegenden der Erde. Von hier aus eroberte das Lebensgefühl Hygge die halbe Welt. In der Mitte des kleinen Landes liegt mein Ziel: Aarhus, die „Stadt des Lächelns“. Dänemarks zweitgrößte Stadt wurde im Jahr 770 von Wikingern gegründet und liegt an der Ostküste Jütlands. Die Luft riecht nach Salzwasser. Ich folge den Schildern Richtung „ARoS“. Auf das Dach von Skandinaviens größtem Museum für moderne Kunst hat der dänisch-isländische Künstler Ólafur Elíasson ein begehbares Kunstwerk gesetzt: einen kreisrunden, 150 Meter langen Regenbogensteg aus Plexiglas. Durch das Glas blickt man wie durch eine rosarote Brille auf das Häusermeer.

[gallery size=""full"" ids=""eyJ1cmwiOiJodHRwczpcL1wvd3d3LmVpbmthdWZzYmFobmhvZi5kZVwvd3AtY29udGVudFwvdXBsb2Fkc1wvMjAxOFwvMDhcL0VLQl9XRUJfQW5sYXNzX0dhbGxlcnlfODIweDQ2MHB4XzA2LTIuanBnIiwidGl0bGUiOiJFS0JfV0VCX0FubGFzc19HYWxsZXJ5XzgyMHg0NjBweF8wNiIsImNhcHRpb24iOiJUaG9tYXMgRXVnc3RlciIsImFsdCI6IiIsImRlc2NyaXB0aW9uIjoiRGVyIFJlZ2VuYm9nZW5zdGVnIGRlcyBcdTIwMWVBUm9TXCIgZ2V3XHUwMGU0aHJ0IGVpbmVuIGt1bnRlcmJ1bnRlbiBCbGljayBcdTAwZmNiZXIgQWFyaHVzLiJ9,eyJ1cmwiOiJodHRwczpcL1wvd3d3LmVpbmthdWZzYmFobmhvZi5kZVwvd3AtY29udGVudFwvdXBsb2Fkc1wvMjAxOFwvMDhcL0VLQl9XRUJfQW5sYXNzX0hlYWRlcl8xMDgweDU0MHB4XzAyLmpwZyIsInRpdGxlIjoiRUtCX1dFQl9Bbmxhc3NfSGVhZGVyXzEwODB4NTQwcHhfMDIiLCJjYXB0aW9uIjoiVGhvbWFzIEV1Z3N0ZXIiLCJhbHQiOiIiLCJkZXNjcmlwdGlvbiI6Ikdhbnogc2NoXHUwMGY2biBoeWdnZWxpZzogRWluZSBBbHRzdGFkdGdhc3NlIGluIEFhcmh1cy4ifQ==""]

Diesen Blick scheinen viele Dänen zu teilen. „Wir können uns auf die schönen Dinge des Lebens konzentrieren“, sagt Isabella de Abrew, die im angesagten Quartier Latin in einem Shop für Vintageklamotten arbeitet. Der Staat nehme einem viele Sorgen ab. Deshalb würden die meisten Dänen die hohen Steuern auch mit einem Lächeln zahlen, berichtet sie. Und was ist mit dem Glücksgeheimnis der Dänen, um das sie die ganze Welt beneidet? Hygge? Isabella de Abrew lacht. Das habe sie schon als Kind gelernt. „Ich habe alle Kissen aus dem ganzen Haus zusammengesucht und mir damit meinen „hyggelig plass“ gebaut – ein gemütliches Plätzchen.“

Gegenüber im Straßencafé rücken die Gäste ihre Stühle in die noch warme Herbstsonne. Ich mache einen Abstecher in das Viertel Frederiksbjerg, das direkt hinter dem Bahnhof liegt. Bunte Cafés reihen sich an Bars mit bärtigen Baristas, Designer-Geschäfte an Trödelläden. Urban und lässig wirkt das Leben hier, die Menschen scheinen zufrieden. Auf einem Wochenmarkt spreche ich Tove Schroeder an. Ob sie mir ihr Glücksgeheimnis verrät, frage ich sie. „Zeit mit der Familie“, antwortet die 70-Jährige, „und eine ausgiebige Runde Tennis.“

[gallery size=""full"" ids=""eyJ1cmwiOiJodHRwczpcL1wvd3d3LmVpbmthdWZzYmFobmhvZi5kZVwvd3AtY29udGVudFwvdXBsb2Fkc1wvMjAxOFwvMDhcL0VLQl9XRUJfQW5sYXNzX0dhbGxlcnlfODIweDQ2MHB4XzA0LTMuanBnIiwidGl0bGUiOiJFS0JfV0VCX0FubGFzc19HYWxsZXJ5XzgyMHg0NjBweF8wNCIsImNhcHRpb24iOiJUaG9tYXMgRXVnc3RlciIsImFsdCI6IiIsImRlc2NyaXB0aW9uIjoiTW9jaHRlIGVzIHNjaG9uIGFscyBLaW5kIGh5Z2dlbGlnOiBWZXJrXHUwMGU0dWZlcmluIElzYWJlbGxhIGRlIEFicmV3LiJ9,eyJ1cmwiOiJodHRwczpcL1wvd3d3LmVpbmthdWZzYmFobmhvZi5kZVwvd3AtY29udGVudFwvdXBsb2Fkc1wvMjAxOFwvMDhcL0VLQl9XRUJfQW5sYXNzX0dhbGxlcnlfODIweDQ2MHB4XzA3LTEuanBnIiwidGl0bGUiOiJFS0JfV0VCX0FubGFzc19HYWxsZXJ5XzgyMHg0NjBweF8wNyIsImNhcHRpb24iOiJUaG9tYXMgRXVnc3RlciIsImFsdCI6IiIsImRlc2NyaXB0aW9uIjoiWnVtIEdsXHUwMGZjY2tzcmV6ZXB0IHZvbiBUb3ZlIFNjaHJcdTAwZjZkZXIgZ2VoXHUwMGY2cnQgYXVjaCBTcG9ydC4ifQ==""]

Bin ich auf meiner Reise von Göttingen bis nach Aarhus dem Glück auf die Schliche gekommen? Zumindest ein wenig. Ob das Klatschen der Wellen, die Heimat oder eine Partie Tennis – feststeht: Das Glück ist etwas sehr Individuelles. Um meines nicht zu verpassen, mache ich mich auf den Heimweg: zu meiner Familie.

<img class=""alignnone size-full wp-image-16495"" src=""https://www.einkaufsbahnhof.de/wp-content/uploads/2018/08/EKB_WEB_Anlass_Bild_VB_1080x608px-3.jpg"" alt="""" width=""1080"" height=""360"" />

<strong>Christian Selzer</strong> <strong>(links)</strong> ist Redakteur und lebt in Berlin. Er ist sich ziemlich sicher, das Glücksgeheimnis der Dänen geknackt zu haben: Unsere nördlichen Nachbarn haben den höchsten Pro- Kopf-Verbrauch an Süßigkeiten in Europa.

<strong>Thomas Eugster (rechts)</strong> ist ein Schweizer Fotograf und arbeitet unter anderem für die ZEIT und Magazine wie brand eins. Er ist sehr glücklich, einen Job zu haben, mit dem er um die Welt reisen kann."
15911,"Frankfurter Buchmesse: Lese- und Hörbuchtipps","<p class=""p--teaser-text"">Zwei Buchhändler von Schmitt &amp; Hahn geben Tipps rund um Georgien – das Gastland der diesjährigen Frankfurter Buchmesse – und das Thema Glück.</p>
Georgien stellt in diesem Jahr als Gastland auf der Frankfurter Buchmesse seine Kultur und Sprache vor. Vielen fällt bisher weder ein Autor noch ein Roman aus dem Land im Kaukasus ein, das als Urlaubsziel immer beliebter wird. Wir haben deshalb bei zwei Buchhändlern nachgefragt: Welche Bücher aus und über Georgien sollte man gelesen haben? Außerdem geben uns die Experten ihre Literatur-Tipps zum Thema Glück – für einen fröhlichen Leseherbst.

[caption id=""attachment_16459"" align=""alignnone"" width=""820""]<img class=""size-full wp-image-16459"" src=""https://www.einkaufsbahnhof.de/wp-content/uploads/2018/08/EKB_WEB_Anlass_Gallery_820x460px_05-3.jpg"" alt="""" width=""820"" height=""460"" /> Weidle Verlag, S. FISCHER Verlag, Droste<br />Verlag, headroom sound production[/caption]
<h3>1. Die vergessene Mitte der Welt – Unterwegs zwischen Tiflis, Baku, Eriwan: Stephan Wackwitz; Fischer Verlag</h3>
Zwei Jahre lang reist Stephan Wackwitz durch den Kaukasus und hält dabei fest, wie das uralte Kulturland Georgien zu einem jungen demokratischen Staat heranwächst. Es geht aber nicht nur um Politik. In seinem Reisebericht beschreibt der Autor auch, wie sich Architektur und Menschen im modernen Georgien verändern.
<h3>2. Eine andere Vorstellung vom Glück: Marc Levy; Headroom Sound Production</h3>
Agatha sitzt seit dreißig Jahren im Gefängnis in Philadelphia. Obwohl sie nur noch fünf Jahre zu verbüßen hat, wagt sie die Flucht. An einer Tankstelle zwingt sie eine Fremde namens Milly, mit ihr nach San Francisco zu fahren. Die zunächst verängstigte Frau findet Gefallen an der geheimnisvollen Agatha und aus der Geiselnahme wird ein Roadtrip quer durch die USA. Und für die junge Milly stellt sich die Frage: Wie weit darf man auf der Suche nach dem Glück gehen?
<h3>3. Reise nach Karabach: Aka Morchiladze; Weidle Verlag</h3>
In Georgiens Hauptstadt Tiflis herrschen 1992 Anarchie und Bürgerkrieg. Inmitten der Unruhen unternimmt der junge Gio mit seinem Freund Goglik einen haarsträubenden Trip: Die beiden Männer fahren in einem alten Lada nach Aserbaidschan, um Drogen zu beschaffen und nach Georgien zu schmuggeln. „Reise nach Karabach“ ist der meistgelesene georgische Roman der letzten Jahrzehnte und eine Mischung aus Roadmovie und Kriegsfilm. Aka Morchiladze gilt als einer der bedeutendsten Gegenwartsautoren Georgiens. Bei der Frankfurter Buchmesse tritt er als einer der Hauptredner auf.
<h3>4. Glücksorte in RheinMain: Fahr hin und werd glücklich: Susanne Dereser und Christine Göttert; Droste Verlag</h3>
Die Reihe „Glücksorte“ ist ein ganz besonderer Reiseführer durch Deutschland. Denn statt zu Sehenswürdigkeiten führt der Guide zu Orten, die einfach glücklich machen. Zum Beispiel zu einem Restaurant, dessen Menü so fantastisch ist, dass es Herzklopfen bereitet. Oder zu einem nostalgischen Kino, das Glücksgefühle bei Filmfans auslöst. Den Atlas für die Glückssuche gibt es unter anderem für die Regionen RheinMain, Hamburg oder den Niederrhein.
<h2>buchmessefachmarkt</h2>
Zur Frankfurter Buchmesse öffnet von 8 bis 20 Uhr der Buchmessefachmarkt im Hauptbahnhof Frankfurt (Main). Reisende und Literaturfans können hier die neuesten Werke frisch von der Messe erstehen. Alle Informationen gibt es <a href=""https://www.einkaufsbahnhof.de/frankfurt-hauptbahnhof/veranstaltungen/buchmessefachmarkt/"" target=""_blank"" rel=""noopener"">hier</a>.

[caption id=""attachment_16444"" align=""alignnone"" width=""1080""]<img class=""wp-image-16444 size-full"" src=""https://www.einkaufsbahnhof.de/wp-content/uploads/2018/08/EKB_WEB_Anlass_Bild_VB_1080x608px-2.jpg"" alt="""" width=""1080"" height=""608"" /> Stefan Meinzer und Stefanie Formella sind Buchhändler bei Schmitt &amp; Hahn im Frankfurter Hauptbahnhof (Foto: Michael Hazkiahu).[/caption]"
15913,"Laufen macht glücklich – auch im Herbst","<p class=""p--teaser-text"">Bei schlechtem Wetter die Laufschuhe schnüren, um das „Runner’s High“ zu erleben – Laufbloggerin Carina Stöwe von travelrunplay.de erklärt, worauf es dabei ankommt.</p>
Laufen stärkt die Gesundheit, und es macht sogar glücklich. Beim Laufen verspüren viele Sportler das rauschhafte „Runner’s High“, das durch die körpereigenen Glückshormone ausgelöst wird. Dem Glück in Laufschuhen steht auch im Herbst nichts entgegen, solange man einige Dinge beachtet.

[gallery size=""full"" ids=""eyJ1cmwiOiJodHRwczpcL1wvd3d3LmVpbmthdWZzYmFobmhvZi5kZVwvd3AtY29udGVudFwvdXBsb2Fkc1wvMjAxOFwvMDhcL0VLQl9XRUJfQW5sYXNzX0dhbGxlcnlfODIweDQ2MHB4XzAzLTUuanBnIiwidGl0bGUiOiJFS0JfV0VCX0FubGFzc19HYWxsZXJ5XzgyMHg0NjBweF8wMyIsImNhcHRpb24iOiJDaHJpcyBaaWVsZWNraVwvd3d3LnppZWxlY2tpLmNvbSIsImFsdCI6IiIsImRlc2NyaXB0aW9uIjoiQ2FyaW5hIFN0XHUwMGY2d2Ugc2NocmVpYnQgYXVmIHRyYXZlbHJ1bnBsYXkuZGUuLi4ifQ==,eyJ1cmwiOiJodHRwczpcL1wvd3d3LmVpbmthdWZzYmFobmhvZi5kZVwvd3AtY29udGVudFwvdXBsb2Fkc1wvMjAxOFwvMDhcL0VLQl9XRUJfQW5sYXNzX0dhbGxlcnlfODIweDQ2MHB4XzA0LTQuanBnIiwidGl0bGUiOiJFS0JfV0VCX0FubGFzc19HYWxsZXJ5XzgyMHg0NjBweF8wNCIsImNhcHRpb24iOiJDaHJpcyBaaWVsZWNraVwvd3d3LnppZWxlY2tpLmNvbSIsImFsdCI6IiIsImRlc2NyaXB0aW9uIjoiXHUwMGZjYmVyIGRhcyBMYXVmZW4sIFJlaXNlbiB1bmQgQWNodHNhbWtlaXQuIn0=,eyJ1cmwiOiJodHRwczpcL1wvd3d3LmVpbmthdWZzYmFobmhvZi5kZVwvd3AtY29udGVudFwvdXBsb2Fkc1wvMjAxOFwvMDhcL0VLQl9XRUJfQW5sYXNzX0JpbGRfVkJfMTA4MHg2MDhweC00LmpwZyIsInRpdGxlIjoiRUtCX1dFQl9Bbmxhc3NfQmlsZF9WQl8xMDgweDYwOHB4IiwiY2FwdGlvbiI6IkNocmlzIFppZWxlY2tpXC93d3cuemllbGVja2kuY29tIiwiYWx0IjoiIiwiZGVzY3JpcHRpb24iOiJBa3R1ZWxsIGxlYnQgZGllIEJsb2dnZXJpbiBpbiBIYW1idXJnLiJ9""]

Entscheidend ist die richtige Kleidung: Zur Grundausstattung gehören eine atmungsaktive sowie wasserabweisende Laufjacke und -hose. Da das Wetter im Herbst unberechenbar ist, sollte man nach dem „Zwiebelprinzip“ die Funktionskleidung in mehreren Schichten tragen.
<h2>Pflicht: Stirnlampe und Reflektoren</h2>
Durch die besonderen Eigenschaften des Materials bleibt die Wärme am Körper und der Schweiß wird durch mehrere Schichten nach außen geleitet. Für gute Sichtbarkeit in der Dunkelheit sorgen eine Stirnlampe und Reflektoren-Bänder. Bei kalten Temperaturen ist das richtige Aufwärmprogramm wichtig: Es bereitet die Bänder und Sehnen auf die Belastung vor und schützt den Körper vor dem Auskühlen.

Einfache Übungen wie Hampelmänner oder eine Runde tanzen verlegen Läufer am besten nach drinnen. Eine kurze Dehneinheit nach dem Training hilft, die Muskeln zu entspannen. Anschließend kann man sich für die erbrachte Leistung mit einem heißen Fußbad belohnen.
<h2>Apps: Lass den Endorphinen freien Lauf</h2>
<h3>ACHTSAMKEIT FÜR ATHLETEN: 7 MIND</h3>
Die App bietet ein Achtsamkeitstraining speziell für Sportler. Die kurzen Einheiten lassen sich leicht ins Training integrieren und helfen dabei, die Konzentration zu steigern. Gratisversion mit Grundlagenkurs oder im Abo ab 4,99 Euro im Monat; für iOS und Android.
<h3>FITNESS FÜR UNTERWEGS: RUNTASTIC</h3>
Runtastic zeichnet Fitnessaktivitäten auf und gehört zu den beliebtesten Jogging-Apps fürs Handy. Am Ende eines Laufs hat man sämtliche Trainingsdaten parat, kann sie mit Freunden teilen und sogar neue Strecken entdecken. Kostenlos für iOS und Android.

[gallery size=""full"" ids=""eyJ1cmwiOiJodHRwczpcL1wvd3d3LmVpbmthdWZzYmFobmhvZi5kZVwvd3AtY29udGVudFwvdXBsb2Fkc1wvMjAxOFwvMDhcL0VLQl9XRUJfQW5sYXNzX0dhbGxlcnlfODIweDQ2MHB4XzAyLTQuanBnIiwidGl0bGUiOiJFS0JfV0VCX0FubGFzc19HYWxsZXJ5XzgyMHg0NjBweF8wMiIsImNhcHRpb24iOiJSdW50YXN0aWMiLCJhbHQiOiIiLCJkZXNjcmlwdGlvbiI6IkRlciBBbGxyb3VuZGVyIGZcdTAwZmNyIGFsbGUgTFx1MDBlNHVmZXI6IFJ1bnRhc3RpYy4ifQ==,eyJ1cmwiOiJodHRwczpcL1wvd3d3LmVpbmthdWZzYmFobmhvZi5kZVwvd3AtY29udGVudFwvdXBsb2Fkc1wvMjAxOFwvMDhcL0VLQl9XRUJfQW5sYXNzX0dhbGxlcnlfODIweDQ2MHB4XzAxLTQuanBnIiwidGl0bGUiOiJFS0JfV0VCX0FubGFzc19HYWxsZXJ5XzgyMHg0NjBweF8wMSIsImNhcHRpb24iOiI3TWluZFwvZnJlZXBpa1xuU21hcnRwaG9uZSwgQXBwLCBNb2NrdXAsIE1vYmlsLCBUZWxlZm9uLCBNZWRpZW4sIEtvbW11bmlrYXRpb24sIFRlY2huaWssIGlwaG9uZVxuIiwiYWx0IjoiIiwiZGVzY3JpcHRpb24iOiJBY2h0c2FtIGJsZWliZW4sIGF1Y2ggYmVpbSBTcG9ydCEgRGFzIGdlaHQgbWl0IDdNaW5kLiJ9""]
<h2>Gewinnspiel</h2>
Machen Sie beim Quiz mit und gewinnen Sie ein Exemplar von „Get Ready to Run“, dem Motivationsbuch für Laufeinsteiger von Carina Stöwe und Mandy Jochmann. Alle Informationen zum Gewinnspiel finden Sie <a href=""https://www.einkaufsbahnhof.de/berlin-hauptbahnhof/gewinnspiele/joggen/"" target=""_blank"" rel=""noopener"">hier</a>."
