id,Title,Content
9592,"Filmreif: Alles Wichtige vom Film-Experten","<p class=""p--teaser-text"">Film-Talk frisch vom roten Teppich: Kino-Experte Knut Elstermann über sehenswerte Highlights des Jahres, Romy Schneider, die #Metoo-Debatte und die Notwendigkeit von Bechern.</p>
<strong>Herr Elstermann, Sie berichten seit vielen Jahren von der Berlinale. Was begeistert sie mittlerweile eigentlich mehr: die Filme oder eher die Partys?</strong>
<strong>Elstermann:</strong> Zu den Partys komme ich leider gar nicht, weil ich jeden Tag auf Sendung bin. Aber mir genügt ohnehin nach wie vor das Programm mit seinen außergewöhnlichen Filmen. Da lässt sich viel entdecken. Außerdem habe ich nicht nur das Privileg, tagsüber ins Kino zu gehen, sondern abends auch gleich noch die Künstler interviewen zu dürfen. Wenn ich irgendwann keine Sendung mehr mache, dann gehe ich partymäßig in die Vollen.

<strong>Was sind die Highlights in diesem Jahr?</strong>
Ich freue mich auf Filme, die man sonst nicht sehen würde. Das sind zum Beispiel die Beiträge aus Russland und Polen.

<strong>Lässt sich bereits ein thematischer Schwerpunkt erkennen?</strong>Der Festival-Direktor Dieter Kosslik hat in diesem Jahr absichtlich darauf verzichtet, einen thematischen roten Faden vorzugeben. Den müssen wir selbst finden. Meiner Meinung nach prägen die Berlinale 2018 vor allem Künstlerbiografien. Kult-Regisseur Gus van Sant stellt beispielsweise seinen Film mit Joaquin Phoenix vor, in dem dieser einen Cartoonisten porträtiert.

<strong>Was erhoffen Sie sich von den deutschen Beiträgen?</strong>
Deutschland ist mit vier Filmen vertreten, was ich schon mal beachtlich finde. Ich hoffe, dass dabei die Vielfalt des deutschen Films, die unterschiedlichen Handschriften dahinter, klar herauskommen. Ganz besonders freue ich mich auf „3 Tage in Quiberon“ – wiederum eine Künstlerbiografie. Der Film erzählt das Leben von Romy Schneider.

<strong>Durch Hollywood ging ein Aufschrei. Wie stark wird die #Metoo-Debatte die Berlinale prägen?</strong>
Es gab die Forderungen, als sichtbares Signal gegen Sexismus den roten Teppich durch einen schwarzen auszutauschen. Das wird wohl nicht passieren. Aber es wird ohne Frage eine neue Sensibilität für das Thema und – nach bewährter politischer Tradition der Berlinale – eine Vielzahl öffentlicher Diskussionsrunden geben.

<strong>Ihr bewegendster Berlinale-Moment jemals ...</strong>
... ist jetzt drei Jahre her. Damals wurde mir der Goldenen Bären für den iranischen Regimekritiker Jafar Panahi ins Studio gebracht. Ohne den Gewinner, denn der stand in seiner Heimat unter Hausarrest. Ein richtig emotionaler Moment für mich!
<h2><span style=""color: #eba134;"">""Das Beste der Berlinale: das Publikum""</span></h2>
<strong>Was darf bei einer guten Berlinale auf keinen Fall fehlen...</strong>
Das Publikum natürlich. Kein anderes A-Festival in Europa hat ein derart großes, interessiertes Publikum. Die Menschen nehmen mitunter lange Anfahrten in Kauf und stehen für Tickets auch gerne mal mitten in der Nacht an.

<strong>Was sollte man bei der Berlinale immer dabei haben?</strong>
In diesem Jahr einen eigenen Becher, weil die Berlinale keine Pappbecher mehr ausgibt. So tut man etwas für die Umwelt und für das eigene Kinovergnügen – wer Kaffee hineinfüllt, bleibt jedenfalls selbst nach mehreren Filmen noch aufmerksam.

<strong>Sie sind beruflich viel unterwegs. Was kaufen Sie am Bahnhof auf den letzten Drücker?</strong>
Ich reise sehr viel mit der Bahn, weil ich kein Auto besitze. Im Zug kann ich am besten arbeiten und lese dort unheimlich gern. Am Bahnhof ergreift mich oft die Panik, dass mir auf der Reise der Lesestoff ausgeht. Deswegen kaufe ich mir oft noch ein Buch.

<strong><em>Knut Elstermann</em></strong><em>, 57, Spitzname Kino King Knut, ist Filmkritiker und Moderator. Seit 20 Jahren moderiert er auf radioeins vom rbb die wöchentliche Sendung „12 Uhr mittags – das Filmmagazin“. Von der Berlinale berichtet er jeden Abend ab 22 Uhr.</em>

[caption id=""attachment_11969"" align=""alignnone"" width=""1024""]<img class=""wp-image-11969 size-large"" src=""https://p451463.mittwaldserver.info/wp-content/uploads/2018/02/EKB_BERLINALE_Interview-1024x706.jpg"" alt=""Knut Elstermann"" width=""1024"" height=""706"" /> rbb – Thomas Ernst[/caption]

<strong><em>Die 68. Berlinale</em></strong><em> fand vom 15. bis 25. Februar 2018 in Berlin statt. Viele Spielstätten befinden sich unmittelbar in der Nähe von Einkaufsbahnhöfen: Zoologischer Garten, Alexanderplatz und Friedrichstraße. Tickets gibt’s zum Beispiel an den Theaterkassen im </em><em>Bahnhof Alexanderplatz</em><em>, im </em><em>Ostbahnhof</em><em> oder in der </em><em>visitBerlin Tourist Info</em><em> am Berliner Hauptbahnhof. Alle Spielstätten und das komplette Programm: </em><a href=""http://www.berlinale.de/"" target=""_blank"" rel=""noopener""><em>www.berlinale.de</em></a>
<blockquote class=""has-image"">
<div></div></blockquote>"
9597,"Perfektes Herbstoutfit","<p class=""p--teaser-text"">In unserer neuesten Umfrage haben wir Reisende und Besucher in den Einkaufsbahnhöfen gefragt, was darf bei Ihrem Herbstoutfit nicht fehlen?</p>
Jessica Vasileiou hat mindestens zehn Schals und jede Menge Leggings, die im Herbst zum Einsatz kommen und die 21-Jährige vor Kälte schützen. „Schals und Leggings dürfen auf keinen Fall beim Herbst-Outfit fehlen“, erklärt die Verkäuferin. Am liebsten sind ihr dabei die Farben Schwarz und Weiß. Auf eine Mütze muss sie leider verzichten, „ich habe viel zu viele haare, die passen da gar nicht alle drunter“, verrät sie. Und bei frischer Brise hilft dann eben ein schön großer Schal zum schicken Mantel.

Beim Thema Herbst steht für Annelie Brzonkalik fest: „Ich freue mich schon auf meinen Mantel, der mich im Oktober warmhält.“ Viel Kuschelkleidung hat die Studentin jedoch nicht mehr, denn Ende des Jahres macht sie sich für ein Jahr auf nach Neuseeland und hat die eigene Garderobe schon wieder auf Sommer umgestellt.

Jürgen aus Achern wartet bei Starbucks im Hauptbahnhof mit Sohn Maximilian auf seine Schwiegermutter, die vom Flughafen mit dem Zug nach Karlsruhe kommt. Wegen der Sperrung der Rheintalbahn holen die beiden die Oma in der Fächerstadt ab; das sei einfacher, erzählt Jürgen. Was nicht fehlen dürfe im Herbst, sei ein Regenschirm, steht für ihn fest. Ein weiterer wichtiger Part des Herbstoutfits seien feste Schuhe. Sohn Maximilian setzt beim Regenschutz lieber auf eine Regenjacke. Außerdem dürfe ein Schal nicht fehlen. Dann fällt ihm noch ein ganz wichtiges Outfit-Element ein: „Eine Beanie-Mütze muss mit.“ Vater Jürgen verrät dann noch, was es mit dem Regenschirm auf sich hat: „Wenn ich den Schirm dabei habe, regnet es nicht“, lacht er.

Mit bunten Accessoires deckt sich Ivana G. aus Düsseldorf im Herbst ein. „Hauptsache auffallend und ein Statement setzten“, lautet ihre Devise, der sie mit farbintensiven Motiven gegen die tristen Monate des Jahres entgegenwirkt. „Mit bunten Gummistiefeln trotze ich verregnetem Herbstwetter“, sagt die 31-Jährige. Überdies empfiehlt sie derbe, globige Biker Boots. „Die sind ein Muss im herbstlichen Schuhschrank“, so die Mitarbeiterin bei Görtz.

Flo aus Pohlheim im Kreis Gießen kann dem Herbst nichts Positives abgewinnen. „Wenn es wie heute den ganzen Tag regnet, habe ich für alle Fälle einen Schirm dabei. Eine wasserabweisende Jacke mit Kapuze schützt mich außerdem vor heftigen Regenschauern und Wind“, sagt der 22-Jährige. Der Plan, mit Freunden das Frankfurter Nachtleben zu erkunden, fiel buchstäblich ins Wasser. „Eigentlich wollten wir von Kneipe zu Kneipe zu ziehen. Doch bei dem Wetter bleiben wir irgendwo an einer Stelle und verbringen einen gemütlichen Abend“, so der junge Mann, der im Übrigen gesund lebt, um gute Abwehrkräfte in der Erkältungszeit zu haben.

Wenn es draußen kälter und regnerisch wird, schwören viele auf ihren Herbstmantel. Nicht so Arian Spaqi: „Ich liebe meine schwarze Lederjacke“, sagt der 19-jährige Münchner. „Sie ist unheimlich bequem und hält mich auch bei schlechtem Wetter schön warm.“ Da schwarz nicht nur seine Lieblingsfarbe sei, sondern auch zu jedem Outfit passe, sei er bereits jetzt für das Herbstwetter bestens gerüstet.

Wenn sie ganz ehrlich ist, freut sich Christin schon etwas auf den Herbst. „Ich freue mich auf die gemütlichen Stunden zu Hause und mag es, mich einzukuscheln“, sagt sie. Apropos einkuscheln: „Beim Herbstoutfit ist für mich ist das Allerwichtigste ein kuscheliger Schal – am liebsten in der Variante XXL. Gerade an Bahnhöfen, wo es oft zugig ist, wappne ich mich so gegen die Herbstkälte. Und klar: Eine dicke Jacke darf natürlich ebenfalls fehlen.“

Wenn es um sein Outfit geht, ist Can Dzaferi eher der schlichte, einfache Typ: „Ich pendele jeden Tag nach Nürnberg, deswegen muss es morgens immer schnell gehen und ich habe nicht viel Zeit, mir zu überlegen, was ich anziehen möchte“, verrät der 18-jährige Schüler. Im Herbst setze der Schnelldorfer auf einen cooles, klassischen Style: „Jeans, ein weißes Shirt und weiße Sneakers gehen immer!“

Wenn es Ende Oktober kälter wird und Dunkelheit sowie Nieselregen Einzug halten, muss man sich notgedrungen wärmer anziehen. Für Nadine bedeutet das vor allem, die Wattejacken aus dem Sommerschlaf zu wecken. Neben der richtigen Isolierung (Daunenfedern) ist für sie auch die Atmungsfähigkeit wichtig: „Ich bin ein sportlicher Typ. Funktionalität kommt für mich noch vor modischen Details“, sagt sie.

&nbsp;
<blockquote class=""has-image"">
<div></div></blockquote>
<blockquote class=""has-image"">
<div></div></blockquote>"
9601,"Herbstzeit ist Lesezeit","<p class=""p--teaser-text"">In unserer neuesten Umfrage haben wir Reisende und Bahnhofsmitarbeiter gefragt, welches Buch empfehlen Sie für stürmische Tage?</p>
Peter Schmidt hat in diesem Jahr sein Abitur gemacht und große Pläne: Der 19-Jährige möchte ein Jahr in den USA und Neuseeland verbringen. Dafür bereitet er sich mit viel Literatur vor. Neben Reiseführer, ganz vielen Romanen und Fantasy hat der Surfer ein besonderes Buch: „Boarderlines“ von Andreas Brendt. „Das ist ein super spannender Bericht über die zehn Jahre lange Reise eines Surfers, der auf der Jagd nach den schönsten Wellen ist“, beschreibt Peter Schmidt.

Sabrina Schmitt, stellvertretende Storemanagerin im Modeschmuck-Shop SIX im Heidelberger Hauptbahnhof, hat die Buchreihe von Lucinda Riley um sieben adoptierte Schwestern für sich entdeckt. Der Vater stirbt und die Schwestern erkunden in den Romanen ihre Herkunft. Und passend zum Umfrage-Thema empfiehlt Sabrina Schmitt den zweiten Band der Reihe „Die Sturmschwester“, den sie gerade überall mit hinnimmt. „Ich finde die Zeitsprünge in die Vergangenheit sehr interessant“, sagt sie über die Geschichten von Riley.

Seinen persönlichen Herbst-Lesetipp hat Martin B. aus Bergisch Gladbach gerade bei LUDWIG.Presse + Buch im Kölner Einkaufsbahnhof erworben. „Der zweite Band der Reihe ‚Köln Plus‘ erklärt allerlei Wissenswertes über die Skulpturen der Stadt. Dieser ungewöhnliche Reiseführer ist nicht nur für Köln-Besucher interessant“, so der 24-Jährige, der das Buch als Geburtstagsgeschenk für seine Tante geplant hat. „Mir selbst habe ich erst kürzlich das Buch ‚Lost in Translation‘ von Ella Frances gegönnt. Es listet Begriffe aus den Sprachen dieser Welt auf, die nicht übersetzbar sind. Ein großer Spaß und wirklich interessant“, findet der Informatikstudent.

Schöne Liebesromane dürfen im Bücherregal von Maria Hayden nicht fehlen: „Ich bin ein riesiger Nicholas Sparks-Fan und finde die Bücher viel besser als die Filme“, verrät die 21-Jährige. Ihr absoluter Favorit des US-amerikanischen Schriftstellers ist „Das Leuchten der Stille“, das von der Beziehung zwischen der Studentin Savannah und dem Soldaten John Tyree handelt. „Ich habe mir das Buch schon drei Mal durchgelesen und nicht genug davon“, gesteht die Münchner Schülerin.

„Eigentlich lese ich so gut wie gar nicht“, gesteht Ervis Cetta. Doch nachdem er die Trilogie „Herr der Ringe“ auf DVD gesehen hatte, wollte der 17-Jährige auch unbedingt die Bücher von J. R. R. Tolkien lesen – auch wenn er anfangs vermutete, dass er sie nicht zu Ende lesen würde. Doch falsch gedacht: „Nachdem ich angefangen hatte, gab es kein Halten mehr: Ich war so vertieft und hatte alle drei Bände in kürzester Zeit durchgelesen.“

„Also, ich lese wirklich für mein Leben gern“, sagt Christina. Leider käme sie seit der Geburt ihrer Kinder allerdings nicht mehr so häufig dazu. „Deswegen lese ich gerade nur noch Bücher, die mich auch wirklich fesseln!“, sagt Christina. Ihre aktuelle Leseempfehlung für stürmische Herbsttage: Dörte Hansens „Altes Land“. „Das habe ich wirklich in einem Rutsch durchgelesen.“

Für Alexandra Piazza ist der Herbst die beste Zeit, um sich gemütlich auf dem Sofa durch einen Schmöker zu lesen. „Spannend und mitreißend muss ein Buch sein, sodass man es gar nicht mehr weglegen möchte – so wie ‚The Watcher‘ von Ross Armstrong. Darin geht es um eine Frau, die nicht nur Vögel mit dem Fernglas beobachtet, sondern auch gerne in die Fenster ihrer Nachbarn späht“, sagt sie. Als Mitarbeiterin bei Relay im Bahnhof Darmstadt kommt sie in den Genuss von Lese-Exemplaren, die noch nicht erschienen sind. „Im September erscheint ‚Die Kinder‘ von Wulf Dorn – ein vielschichtiger, intelligenter Psychothriller“, empfiehlt die junge Frau.

&nbsp;"
9604,"Was wir beim Kofferpacken oft vergessen","<p class=""p--teaser-text"">Wer verreist, vergisst auch leider oftmals das Ein oder Andere einzupacken. Wir haben Reisende gefragt, was Sie gerne einmal vergessen.</p>

<h3>Irmgard, Hauptbahnhof Köln:</h3>
„Es passiert gerne mal, dass ich beim Kofferpacken eine Kleinigkeit vergesse“, verrät Irmgard aus Köln. „Meist sind das Dinge wie Deo, Shampoo oder die Zahncreme. Auf Kriegsfuß stehe ich mit meiner Haarbürste. Die vergesse ich ständig“, lacht die 58-jährige Verkäuferin. Glücklicherweise gebe es bei ROSSMANN EXPRESS eine große Auswahl an Hygiene- und Kosmetikprodukten auch in praktischen Reisegrößen, und auch Kämme und Haarbürsten sind im Sortiment.
<h3>Ingrid, Hauptbahnhof Mainz:</h3>
Ingrid aus Heidelberg ist normalerweise gut organisiert und vergisst nicht so schnell was. „Doch einmal, bei der Fahrt zum Vierwaldstädter See habe ich alle Schuhe vergessen“, sagt sie. Warum sie die nicht eingepackt hat, kann sie sich nicht erklären. „Obwohl ich die Schuhe vorher zum Einpacken hingestellt habe, waren sie nicht im Koffer“, lacht die 64-Jährige. Auch ihre Freunde, mit denen Sie von Heidelberg aus nach Boppard zum Mittelalterfest fuhr, haben schon einmal etwas vergessen einzupacken.
<h3>Rainer, Hauptbahnhof Bremen:</h3>
„Eigentlich bin ein sehr gut organisierter Typ und vergesse selten etwas“, sagt Rainer aus Hamburg. Doch dann grinst er und gibt zu: „Doch manchmal geht auch mir etwas durch die Lappen.“ Bei seiner letzten Reise habe er beispielsweise erst im Hotel gemerkt, dass seine Zahnbürste immer noch auf dem Armaturenbrett im Badezimmer Zuhause liege. „Aber so etwas kann man ja schnell nachkaufen. Hier am Bremer Hauptbahnhof würde ich in so einem Fall schnell zu ROSSMANN hochlaufen. Die haben ja fast alles.“

[gallery ids=""eyJ1cmwiOiJodHRwczpcL1wvd3d3LmVpbmthdWZzYmFobmhvZi5kZVwvd3AtY29udGVudFwvdXBsb2Fkc1wvMjAxN1wvMDhcL0VLQl9XRUJfTGFzdF9NaW51dGVfU2hvcHBpbmdfVW1mcmFnZV9HYWxlcmllXzgyMHg0NjBweF8wMS5qcGciLCJ0aXRsZSI6IkVLQl9XRUJfTGFzdF9NaW51dGVfU2hvcHBpbmdfVW1mcmFnZV9HYWxlcmllXzgyMHg0NjBweF8wMSIsImNhcHRpb24iOiJSZWRha3Rpb24iLCJhbHQiOiIiLCJkZXNjcmlwdGlvbiI6InYubC5uLnIuOiBJcm1nYXJkLCBJbmdyaWQgdW5kIFJhaW5lciJ9,eyJ1cmwiOiJodHRwczpcL1wvd3d3LmVpbmthdWZzYmFobmhvZi5kZVwvd3AtY29udGVudFwvdXBsb2Fkc1wvMjAxN1wvMDhcL0VLQl9XRUJfTGFzdF9NaW51dGVfU2hvcHBpbmdfVW1mcmFnZV9HYWxlcmllXzgyMHg0NjBweF8wMi5qcGciLCJ0aXRsZSI6IkVLQl9XRUJfTGFzdF9NaW51dGVfU2hvcHBpbmdfVW1mcmFnZV9HYWxlcmllXzgyMHg0NjBweF8wMiIsImNhcHRpb24iOiJSZWRha3Rpb24iLCJhbHQiOiIiLCJkZXNjcmlwdGlvbiI6InYubC5uLnIuOiBBYmFzc2luIE11bWFuZCwgUHV5YSBBd2FkIHVuZCBFbGxlbiJ9""]
<h3>Abassin Mumand, Hauptbahnhof München:</h3>
„Ich habe etwas längere Haare und binde mir sehr gerne einen kleinen Zopf – vor allem bei heißen Temperaturen“, sagt Abassin Mumand, „daher brauchen nicht nur Frauen Haargummis.“ Auf Reisen sei es allerdings schon mehrfach vorgekommen, dass der Elektroingenieur ohne Haargummis aus dem Haus gegangen sei. Vor der Zugfahrt legt der 24-jährige Münchner daher öfters mal einen Zwischenstopp bei den Münchner Einkaufsbahnhöfen ein.
<h2>Zack und los!</h2>
<h3>Puya Awad, Hauptbahnhof Nürnberg:</h3>
„Ich bin sehr viel unterwegs und vergesse schon hin und wieder mal etwas“, gesteht der 19-jährige Puya Awad. Seit sieben Monaten wohnt der gebürtige Dubaier in Deutschland und muss berufsbedingt viel reisen. „Und ganz oft vergesse ich dabei meine Zahnbürste – da ist Müller meine Rettung“. Es sei auch schon einmal vorgekommen, dass Puya Awad seine Kopfhörer vergessen hat: „Für eine lange Zugfahrt brauche ich Musik – dann macht es doppelt soviel Spaß, sich die wunderschöne deutsche Landschaft anzusehen“.
<h3>Ellen, Hauptbahnhof Karlsruhe:</h3>
Noch nie habe sie etwas vergessen, wenn es in den Urlaub ging, betont Ellen. Die Service-Kraft bei HANZundFRANZ im Karlsruher Hauptbahnhof ist offenbar gut organisiert. „Ich bin immer sehr gut vorbereitet, packe meine Koffer rechtzeitig einen Tag bevor es losgeht“, beschreibt sie ihre Reisevorbereitungen. Eine Freundin hingegen sei da ganz anders. Die vergesse immer wieder Kleinigkeiten, die aber wichtig seien: Sonnencreme und Zahnpasta beispielsweise. Die kaufe sie dann eben in den Shops der Bahnhöfe oder Flughäfen, die glücklicherweise täglich geöffnet hätten."
9606,"Eiszeit in Heidelberg (o_o)","<p class=""p--teaser-text"">Das Mannheimer Eiscafé ""Gran Caffé Vittoria"" mit einer Dependance vor dem Heidelberger Hauptbahnhof bietet 24 leckere Eissorten an.</p>
Im vergangenen Sommer hatte der Eisverkaufsstand vor dem Heidelberger Hauptbahnhof Premiere. Jetzt bietet das im Mannheimer Hauptbahnhof beheimatete <a href=""https://www.einkaufsbahnhof.de/mannheim-hauptbahnhof/schlemmen/gastronomie/gran-cafe-vittoria-s6690"" target=""_blank"" rel=""noopener"">„Gran Caffé Vittoria“</a> seine Eisspezialitäten wieder täglich von 11.30 bis 21 Uhr vor dem Nordeingang des Bahnhofsgebäudes an. Aus 24 Sorten der leckeren Süßspeise können die Kunden wählen. In Mannheim ist das Eis aus dem Hause Raimondo Lo Presti ein Begriff, nicht nur für Bahnreisende. „Die Qualität des Eises ist wirklich top“, lobt Karl-Dieter Rothhaas, bei der DB Station&amp;Service AG für die Shop-Vermietung in Mannheim und Heidelberg zuständig, die Produkte Lo Prestis.
<h2>In einer Kundenbefragung wurde das „Gran Caffé Vittoria“ schon als beste Eisdiele Mannheims bezeichnet.</h2>
Kein Wunder also, dass man Raimondo Lo Presti die Möglichkeit gab einen mobilen Eisverkaufswagen in Heidelberg zu platzieren. Gerade während der Sommermonate, in denen besonders viele Touristen nach Heidelberg kämen, sei der Eisverkaufsstand eine gute Ergänzung für das Sortiment des Bahnhofs, betont Rothhaas. Noch bis Ende September wird das „Gran Caffé Vittoria“ den Menschen in Heidelberg das Leben versüßen."
9607,"Nanu-Nana hat Geburtstag (o_o)","<p class=""p--teaser-text"">Nanu-Nana ist seit 16 Jahren mit einer Filiale im Basement des Mannheimer Hauptbahnhofs und feiert in diesem Jahr sein 45-jähriges Bestehen.</p>
Geschenkartikel und Wohnaccessoires sind die Begriffe, die das Sortiment von <a href=""https://www.einkaufsbahnhof.de/mannheim-hauptbahnhof/shoppen/geschenke/nanu-nana-s6705"" target=""_blank"" rel=""noopener"">Nanu-Nana</a>beschreiben. Die Vielfalt der Artikel machen einen Besuch bei Nanu-Nana zu einem spannenden Einkaufserlebnis für Kunden jeden Alters. Das in Oldenburg gegründete Unternehmen feiert in diesem Jahr sein 45-jähriges Bestehen. Im Mannheimer Hauptbahnhof lädt Nanu-Nana seit 16 Jahren zum Suchen-Stöbern-Finden, so der Firmen-Slogan, ein. Bei einem Unternehmen, in dessen Filialen die Kunden viel Nützliches wie auch außergewöhnliche und spaßige Dinge finden können, wundert es nicht, dass es den ungewöhnlichen Namen Nanu-Nana trägt. Dabei geht der Name auf eine Zeit zurück, da Firmengründer Joachim Hoepp noch nicht ahnen konnte, dass er einmal ein Unternehmen mit heute 300 Filialen in Deutschland gründen würde.
<h2>AUSSERGEWÖHNLICHE NAMENSFINDUNG</h2>
Jochim Hoepp wurde auf der Nordseeinsel Langeoog geboren und arbeitete als junger Mann als Strandfotograf für das Fotogeschäft der Eltern. Stets auf der Suche nach Stars, Sternchen und tollen Motiven, entdeckte er die in den 50er Jahren sehr bekannte Schlagersängerin Lale Andersen („Ein Schiff wird kommen“) und wartete auf den richtigen Moment, um sein Foto zu schießen. Da ertönte plötzlich der Ruf: „Nanu-Nana, wer kommt denn da? Nanu-Nana wer fotografiert denn da?“ Ein Inselurlauber, der am selben Tag ebenfalls fotografiert worden war, hatte den Lichtbildner Hoepp wiedererkannt. Der Satz verbreitet sich wohl sehr schnell auf der ganzen Insel und war von nun an in aller Munde. Ein Slogan war geboren und Joachim Hoepp fand ihn Jahre später als Name für sein erstes Geschäft passend.
<h3>IN OLDENBURG DAS ERSTE GESCHÄFT</h3>
Im Oktober 1972 eröffnete Hoepp in Oldenburg das erste Nanu-Nana-Geschäft für Geschenkartikel und Wohnaccessoires. Eine kontinuierliche Entwicklung setzte ein. Die Produktpalette war und ist stets auf der Höhe der Zeit und sehr vielfältig. Zum 40. Geburtstag startete 2012 der Nanu-Nana-Onlineshop. 2017 feiert das Oldenburger Familienunternehmen also das 45-jährige Bestehen. Aus diesem Anlass bedankte sich Nanu-Nana in seinen Filialen Anfang Juni mit einer dreitägigen Dankeschön Aktion bei den Kunden mit kleinen Präsenten. „Das war eine schöne Aktion und die Kunden haben sich sehr gefreut“, so Angela Balogh, Filialleitung von Nanu-Nana im Mannheimer Hauptbahnhof. Dort ist der Spezialist für außergewöhnliche Geschenke und Accessoires seit 16 Jahre im Basement ansässig und seit 16 Jahren ist auch Angela Balogh „an Bord“, hat die Filiale mit aufgebaut. „Wenn wir uns am Anfang am Telefon mit „Hallo, hier ist Nanu-Nana“ gemeldet haben, waren die Reaktionen teilweise sehr überrascht“, erzählt Balogh.
<h3>GROSSE ZAHL AN STAMMKUNDEN IN MANNHEIM</h3>
Die Kundschaft im Hauptbahnhof bestehe natürlich aus Reisenden und Touristen – viele aus den USA und Asien – auf dem Weg zum Flughafen in Frankfurt, so die Filialleitung. Da würden eben Souvenirs gekauft. Nanu-Nana hat jedoch nicht nur Laufkundschaft: „Obwohl wir eine Bahnhofsfiliale sind, haben wir viele Stammkunden. Die schauen sich nach den Wohnaccessoires um, suchen ein Geburtstagsgeschenk oder eine schöne Dose, um Geschenke zu verpacken“, erzählt Angela Balogh. Die wöchentlich neuen Angebote, seien eben sehr attraktiv. „Es gibt bei uns immer etwas zu entdecken“, so Balogh weiter. Und das für Jung und Alt. Sie habe treue Kunden, die im Onlineshop ein Produkt entdecken und es dann im Hauptbahnhof kaufen.

Heute reicht das Sortiment vom kleinen Untersetzer oder lustig bedrucktem Becher bis hin zu nützlichen Küchenhelfern, Kaffee, Tee, Tische und Stühle oder LED-Leuchten für den Garten. Bei den Kunden sehr beliebt seien die vielen Verpackungsartikel, die vor allem im Weihnachtsgeschäft besonders gut gingen. Aktuell lockt Nanu-Nana mit einem großen Sommersortiment unter anderem mit Espandrillos, Badematten, Strohhalmgläsern und den top aktuellen Finger Spinnern, wie Angela Balogh betont.

<strong>Öffnungszeiten: </strong>
Mo. bis Sa.: 8 bis 21 Uhr
Sonntag: 8 bis 20 Uhr
Feiertag: 9 bis 20 Uhr

&nbsp;"
